{
  "format": "pocket-profile/2",
  "id": "zephyr-contract",
  "platform": "esp-idf",
  "form": "takeover",
  "cadences": [30],
  "display": {
    "logicalViewports": [[8, 6]],
    "presentations": ["native"],
    "rasterDensity": 1,
    "animation": "repaint"
  },
  "panel": {
    "primary": [8, 6]
  },
  "capabilities": ["input.buttons", "input.touch"],
  "roleCapabilities": {
    "systemUI": []
  }
}
