{
  "format": "pocket-profile/2",
  "id": "linux-app",
  "platform": "linux",
  "form": "window",
  "cadences": [60, 30],
  "display": {
    "logicalViewports": [[800, 600]],
    "dynamicViewport": {
      "min": [240, 180],
      "max": [4096, 4096],
      "acceptsFixed": true
    },
    "presentations": ["native"],
    "rasterDensity": 1,
    "animation": "composited"
  },
  "panel": {
    "primary": [1280, 800]
  },
  "capabilities": [
    "display.viewport.live",
    "input.buttons",
    "io.offload",
    "text.glyphs.baked",
    "text.layout.offload"
  ],
  "roleCapabilities": {
    "systemUI": ["ui.compositor-surfaces"]
  }
}
