{
  "format": "pocket-profile/2",
  "id": "gba",
  "platform": "gba",
  "form": "takeover",
  "cadences": [30],
  "display": {
    "logicalViewports": [[240, 160]],
    "presentations": ["native"],
    "rasterDensity": 1,
    "animation": "repaint"
  },
  "panel": {
    "primary": [240, 160]
  },
  "capabilities": ["input.buttons", "text.glyphs.baked"]
}
