{
  "format": "pocket-profile/2",
  "id": "vita",
  "platform": "vita",
  "form": "takeover",
  "cadences": [60],
  "display": {
    "logicalViewports": [[480, 272]],
    "presentations": ["integer-fit"],
    "rasterDensity": 2,
    "animation": "composited"
  },
  "panel": {
    "primary": [960, 544]
  },
  "capabilities": [
    "input.analog.left",
    "input.buttons",
    "input.cursor",
    "input.touch",
    "text.glyphs.baked"
  ]
}
