{
  "format": "pocket-profile/2",
  "id": "ipodtouch-dev",
  "platform": "ios",
  "form": "takeover",
  "cadences": [60],
  "display": {
    "logicalViewports": [[320, 568]],
    "presentations": ["native"],
    "rasterDensity": 2,
    "animation": "composited"
  },
  "panel": {
    "primary": [640, 1136]
  },
  "capabilities": ["input.touch", "text.glyphs.baked"]
}
