{
  "format": "pocket-profile/2",
  "id": "ipodnano",
  "platform": "rockbox",
  "form": "takeover",
  "cadences": [30],
  "display": {
    "logicalViewports": [[176, 132]],
    "presentations": ["native"],
    "rasterDensity": 1,
    "animation": "repaint"
  },
  "panel": {
    "primary": [176, 132]
  },
  "capabilities": ["input.buttons", "text.glyphs.baked"]
}
